id,name,producer,country,region,zone,denomination,vintage,grape_varieties,color,color_detail,body,tannins,acidity,quality,balance,persistence,alcohol_level,sweetness,food_pairings,occasion,style_tags,price_avg,price_min,availability,purchase_url,description
1,Trebbiano d'Abruzzo DOC,Valle Reale,Italy,Abruzzo,Trebbiano d'Abruzzo,Trebbiano d'Abruzzo,2022,trebbiano,bianco,,medio,,alta,2.8,3.0,2.6,12.5,secco,pesce_griglia|pasta_sugo_verdure,aperitivo,fresco;minerale,9.5,8.9,available,,Bianco fresco e agrumato con note di limone e fiori bianchi.
2,Nebbiolo Langhe DOC,Marchesi di Barolo,Italy,Piemonte,Langhe,Langhe Nebbiolo,2021,nebbiolo,rosso,,medio,medio,media,3.6,3.5,3.7,13.5,secco,carne_arrosto_grigliata|formaggi_stagionati,cena,strutturato;frutta rossa,18.9,17.5,available,,"Rosso elegante con ciliegia, rosa e leggere spezie."
3,Taurasi DOCG,Mastroberardino,Italy,Campania,Taurasi,Taurasi,2019,aglianico,rosso,,alto,alto,media,4.5,4.3,4.6,14.5,secco,carne_rossa_umido|selvaggina,cena importante,potente;longevo,39.0,36.0,available,,"Rosso intenso con prugna, tabacco, spezie e struttura profonda."
4,Sagrantino di Montefalco DOCG,Arnaldo Caprai,Italy,Umbria,Montefalco,Sagrantino di Montefalco,2018,sagrantino,rosso,,alto,alto,media,4.7,4.6,4.8,15.0,secco,carne_rossa_umido|selvaggina,meditazione,tannico;potente,44.0,41.0,available,,"Rosso molto strutturato con mora, cacao e spezie scure."
5,Lugana DOC,Cà dei Frati,Italy,Lombardia,Lugana,Lugana,2023,turbiana,bianco,,medio,,media,3.9,4.0,3.8,13.0,secco,pesce_griglia|risotto_verdure,cena,fresco;minerale;agrumi,16.5,15.2,available,,"Bianco elegante con agrumi, pesca bianca e mineralità."
6,Chianti Classico DOCG,Castello di Ama,Italy,Toscana,Chianti,Chianti Classico,2021,sangiovese,rosso,,medio,medio,alta,3.8,3.9,3.7,13.5,secco,pasta_sugo_verdure|carne_arrosto_grigliata,pranzo,strutturato;equilibrato,21.0,19.5,available,,"Note di ciliegia, viola e spezie leggere con buona freschezza."
7,Barbera d'Alba DOC,G.D. Vajra,Italy,Piemonte,Alba,Barbera d'Alba,2022,barbera,rosso,,medio,,alta,3.2,3.1,3.0,13.0,secco,pasta_sugo_verdure|affettati_salumi,quotidiano,fresco;fruttato,13.5,12.0,available,,Fruttato e vivace con ciliegia e acidità brillante.
8,Vermentino di Sardegna DOC,Argiolas,Italy,Sardegna,Vermentino,Vermentino,2023,vermentino,bianco,,leggero,,alta,3.4,3.5,3.3,12.5,secco,pesce_griglia|pesce_crostacei_vapore,estate,fresco;floreale,12.0,10.8,available,,"Bianco aromatico con agrumi, fiori e finale sapido."
9,Barolo DOCG Serralunga d'Alba,G.D. Vajra,Italy,Piemonte,Serralunga d'Alba,Barolo,2019,nebbiolo,rosso,rosso,high,high,high,4.6,4.5,4.7,14.5,secco,carne_rossa_umido|selvaggina|formaggi_stagionati,cena importante,strutturato;potente;tannico;longevo,65.0,58.0,in_stock,,"Barolo di Serralunga: tannino deciso, rosa appassita, liquirizia e spezie, struttura profonda."
10,Barolo DOCG Monforte d'Alba,Vietti,Italy,Piemonte,Monforte d'Alba,Barolo,2018,nebbiolo,rosso,rosso,high,high,high,4.7,4.6,4.8,14.5,secco,carne_rossa_umido|selvaggina|risotto_funghi,cena importante,strutturato;potente;tannico;complesso,72.0,64.0,in_stock,,"Barolo intenso: ciliegia nera, goudron, spezie e finale lungo, molto strutturato."
11,Barbaresco DOCG,Produttori del Barbaresco,Italy,Piemonte,Barbaresco,Barbaresco,2020,nebbiolo,rosso,rosso,high,medium,high,4.4,4.3,4.5,14.0,secco,carne_arrosto_grigliata|formaggi_stagionati|risotto_verdure,cena,strutturato;elegante;tannico,42.0,38.0,in_stock,,"Nebbiolo elegante ma di struttura: rosa, ciliegia, spezie e tannino presente."
12,Barolo DOCG Serralunga d'Alba,Esempio Cantina,Italy,Piemonte,Serralunga d'Alba,Barolo,2020,nebbiolo,rosso,rosso,high,high,medium,4.8,4.7,4.9,14.5,secco,carne_rossa_umido|selvaggina|formaggi_stagionati,cena importante,strutturato;longevo;speziato,65.0,55.0,available,,"Nebbiolo profondo e tannico con note di rosa, catrame, ciliegia matura e spezie."
13,Brunello di Montalcino DOCG,Esempio Tenuta,Italy,Toscana,Montalcino,Brunello di Montalcino,2019,sangiovese,rosso,rosso,high,medium,medium,4.7,4.6,4.8,14.0,secco,carne_rossa_umido|carne_arrosto_grigliata|risotto_funghi,cena importante,strutturato;equilibrato;longevo,52.0,45.0,available,,"Sangiovese elegante con ciliegia, tabacco, cuoio e finale lungo."
14,Amarone della Valpolicella DOCG,Esempio Azienda,Italy,Veneto,Valpolicella,Amarone della Valpolicella,2018,corvina;corvinone;rondinella,rosso,rosso,high,medium,low,4.6,4.4,4.8,15.5,secco,carne_rossa_umido|formaggi_stagionati,meditazione,potente;ricco;speziato,58.0,49.0,available,,"Rosso ricco e avvolgente con amarena sotto spirito, cacao e spezie dolci."
15,Etna Rosso DOC,Esempio Cantina Etna,Italy,Sicilia,Etna,Etna Rosso,2022,nerello mascalese;nerello cappuccio,rosso,rosso,medium,medium,high,4.3,4.3,4.2,13.5,secco,carni_bianche_umido|risotto_funghi|affettati_salumi,cena,minerale;fine;fresco,29.0,24.0,available,,"Rosso vulcanico fine con frutti rossi, erbe mediterranee e mineralità."
16,Franciacorta DOCG Brut,Esempio Franciacorta,Italy,Lombardia,Franciacorta,Franciacorta,NV,chardonnay;pinot nero,bianco,spumante,medium,low,high,4.4,4.4,4.3,12.5,secco,stuzzichini_tartine|pesce_griglia|frittura_pesce,aperitivo,spumante;metodo classico;brut,34.0,29.0,available,,"Metodo classico elegante con crosta di pane, agrumi e bollicina fine."
17,Verdicchio dei Castelli di Jesi DOC Classico,Esempio Marche,Italy,Marche,Castelli di Jesi,Verdicchio dei Castelli di Jesi,2023,verdicchio,bianco,bianco,medium,low,high,4.1,4.2,4.0,13.0,secco,pesce_griglia|risotto_verdure|pasta_sugo_verdure,cena,minerale;agrumi;fresco,14.5,12.0,available,,"Bianco sapido con agrumi, mandorla e finale pulito."
18,Fiano di Avellino DOCG,Esempio Irpinia,Italy,Campania,Irpinia,Fiano di Avellino,2023,fiano,bianco,bianco,medium,low,medium,4.2,4.2,4.1,13.5,secco,pesce_griglia|pesce_crostacei_vapore|formaggi_freschi,cena,aromatico;minerale,18.0,15.0,available,,"Bianco complesso con fiori bianchi, nocciola e tocchi affumicati."
19,Ribolla Gialla Collio DOC,Esempio Collio,Italy,Friuli-Venezia Giulia,Collio,Collio,2023,ribolla gialla,bianco,bianco,low,low,high,4.0,4.1,3.9,12.5,secco,stuzzichini_tartine|pesce_griglia|risotto_verdure,aperitivo,fresco;agrumi;floreale,17.5,15.0,available,,"Bianco fresco e floreale con limone, fiori e finale sapido."
20,Nero d'Avola Sicilia DOC,Esempio Sicilia,Italy,Sicilia,Sicilia,Sicilia,2022,nero d'avola,rosso,rosso,medium,medium,medium,3.9,3.9,3.8,13.5,secco,pasta_sugo_verdure|carne_arrosto_grigliata,cena,fruttato;speziato,11.9,9.9,available,,"Rosso mediterraneo con mora, prugna e spezie leggere."
21,Riesling Alto Adige DOC,Esempio Alto Adige,Italy,Trentino-Alto Adige,Alto Adige,Alto Adige,2023,riesling,bianco,bianco,low,low,high,4.1,4.1,4.0,12.0,secco,pesce_griglia|pesce_crostacei_vapore|formaggi_stagionati,cena,minerale;agrumi;idrocarburi,19.5,17.0,available,,"Bianco teso e minerale con lime, pesca e tipica nota idrocarburica."
22,Cerasuolo d'Abruzzo DOC,Valentini (esempio),Italy,Abruzzo,Abruzzo,Cerasuolo d'Abruzzo,2023,montepulciano,rosato,rosato,medium,low,medium,4.2,4.2,4.1,13.0,secco,stuzzichini_tartine|pesce_griglia|affettati_salumi|pizza,estate,fresco;fruttato;scorrevole,16.00,14.00,in_stock,,"Rosato intenso e fresco: ciliegia, melograno e note floreali. Versatile dall’aperitivo alla pizza."
23,Chiaretto di Bardolino DOC,Cantina Bardolino (esempio),Italy,Veneto,Bardolino,Bardolino Chiaretto,2023,corvina;rondinella;molinaro,rosato,rosato,low,low,medium,4.1,4.1,4.0,12.5,secco,stuzzichini_tartine|pesce_griglia|risotto_verdure|frittura_pesce,aperitivo,fresco;floreale;leggero,12.00,10.00,in_stock,,"Rosato delicato e fragrante con fragolina, agrumi e finale sapido. Perfetto per aperitivo e piatti leggeri."
24,Côtes de Provence Rosé AOC,Domaine de Provence (esempio),France,Provence,Côtes de Provence,Côtes de Provence,2023,grenache;cinsault;syrah,rosato,rosato,low,low,medium,4.2,4.2,4.0,12.5,secco,stuzzichini_tartine|pesce_griglia|pasta_sugo_verdure|risotto_verdure,estate,fresco;minerale;agrumi,18.00,16.00,in_stock,,"Rosé provenzale fine e minerale: pompelmo, pesca bianca e note saline. Ideale per aperitivo e pesce."
25,Chablis AOC Domaine Example,Domaine Martin,France,Bourgogne,Chablis,Chablis,2023,chardonnay,bianco,,medium,low,high,4.3,4.4,4.2,12.5,secco,sushi_sashimi|tartare_pesce|pesce_crostacei_vapore,cena,minerale;agrumi;teso,28.0,24.0,available,,"Bianco teso e minerale con limone, pietra focaia e grande freschezza. Ideale con sushi e crudi di pesce."
26,Etna Bianco DOC Example,Tenuta Etna,Italy,Sicilia,Etna,Etna Bianco,2023,carricante,bianco,,medium,low,high,4.4,4.3,4.2,13.0,secco,tartare_pesce|antipasti_pesce_affumicato|pesce_griglia,cena,minerale;salino;agrumi,26.0,22.0,available,,Bianco vulcanico con agrumi e note saline. Perfetto con tartare e pesce affumicato.
27,Soave Classico DOC Example,Cantina Soave,Italy,Veneto,Soave,Soave Classico,2023,garganega,bianco,,medium,low,medium,3.9,4.0,3.8,12.5,secco,antipasti_pesce_affumicato|pesce_griglia|stuzzichini_tartine,aperitivo,fresco;floreale;mandorla,14.0,11.5,available,,Bianco fresco con fiori bianchi e mandorla. Ottimo con antipasti e salmone affumicato.
28,Vermentino di Gallura DOCG Example,Cantina Gallura,Italy,Sardegna,Gallura,Vermentino di Gallura,2023,vermentino,bianco,,medium,low,high,4.2,4.2,4.1,13.5,secco,zuppa_pesce_bianco|pesce_umido|pesce_griglia,cena,minerale;agrumi;salino,19.0,16.5,available,,"Bianco sapido e agrumato, ideale per zuppe di pesce in bianco e piatti di mare in umido."
29,Rosato Salento IGP Example,Tenuta Salento,Italy,Puglia,Salento,Salento Rosato,2023,negroamaro,rosato,,medium,low,medium,3.8,3.9,3.7,13.0,secco,zuppa_pesce_pomodoro|pesce_umido|pizza,estate,fruttato;fresco;scorrevole,13.5,11.0,available,,Rosato fresco e fruttato con note di fragola e pompelmo. Ottimo con zuppe di pesce al pomodoro.
30,Verdicchio dei Castelli di Jesi DOC Classico,Umani Ronchi,Italy,Marche,Castelli di Jesi,Verdicchio dei Castelli di Jesi,2023,verdicchio,bianco,bianco,medium,low,high,4.2,4.2,4.1,13.0,secco,sushi_sashimi;pesce_griglia,cena,minerale;agrumi;teso,14.90,12.90,available,,"Sapido e agrumato, ottimo su sushi e sashimi; chiusura pulita e minerale."
31,Franciacorta DOCG Brut,Berlucchi,Italy,Lombardia,Franciacorta,Franciacorta,NV,chardonnay;pinot nero,bianco,spumante,medium,low,high,4.4,4.4,4.3,12.5,secco,tartare_pesce;stuzzichini_tartine,aperitivo,metodo classico;brut;crosta di pane,32.00,28.00,available,,"Bollicina fine e secca, perfetta per tartare di pesce e antipasti eleganti."
32,Etna Bianco DOC,Benanti,Italy,Sicilia,Etna,Etna Bianco,2022,carricante,bianco,bianco,medium,low,high,4.3,4.2,4.2,12.5,secco,zuppa_pesce_bianco;pesce_umido,cena,minerale;sapido;agrumi,24.00,20.00,available,,"Minerale e sapido, regge bene zuppe di pesce in bianco e piatti di mare in umido."
33,Cerasuolo d'Abruzzo DOC,Masciarelli,Italy,Abruzzo,Abruzzo,Cerasuolo d'Abruzzo,2023,montepulciano,rosato,rosato,medium,low,medium,4.1,4.1,4.0,13.0,secco,zuppa_pesce_pomodoro;pesce_griglia,estate,fruttato;fresco;versatile,12.50,10.90,available,,Rosato più “gastronomico”: ottimo con zuppe di pesce al pomodoro e grigliate di mare.
34,Riesling Alto Adige DOC,Cantina Terlano,Italy,Trentino-Alto Adige,Alto Adige,Alto Adige,2023,riesling,bianco,bianco,low,low,high,4.2,4.1,4.1,12.0,secco,antipasti_pesce_affumicato;sushi_sashimi,cena,agrumi;teso;minerale,19.50,17.00,available,,"Teso e agrumato: funziona benissimo su pesce affumicato (salmone, trota) e crudi."
35,Vermentino Riviera Ligure DOC,Cantina Example,Italy,Liguria,Riviera Ligure,Riviera Ligure di Ponente,2023,vermentino,bianco,bianco,low,low,high,4.0,4.1,3.9,12.5,secco,antipasti_caldi_pesce,aperitivo,fresco;agrumi;minerale,15.0,13.0,available,,"Bianco fresco e sapido: agrumi, erbe mediterranee e finale salino. Perfetto con antipasti caldi di pesce."
36,Verdicchio dei Castelli di Jesi DOC Classico,Cantina Example Marche,Italy,Marche,Castelli di Jesi,Verdicchio dei Castelli di Jesi,2023,verdicchio,bianco,bianco,medium,low,high,4.2,4.2,4.1,13.0,secco,pasta_pesce_bianco,cena,minerale;mandorla;fresco,14.5,12.0,available,,"Sapido e strutturato, agrumi e mandorla. Ottimo con pasta al pesce in bianco."
37,Etna Rosato DOC,Cantina Etna Example,Italy,Sicilia,Etna,Etna,2023,nerello mascalese,rosato,rosato,low,low,high,4.1,4.1,4.0,12.5,secco,pasta_pesce_pomodoro,estate,fresco;fruttato;sapido,18.0,16.0,available,,"Rosato teso e minerale: fragolina, agrumi e note saline. Perfetto con pasta al pesce col pomodoro."
38,Montepulciano d'Abruzzo DOC,Cantina Abruzzo Example,Italy,Abruzzo,Abruzzo,Montepulciano d'Abruzzo,2022,montepulciano,rosso,rosso,medium,medium,medium,3.8,3.8,3.7,13.5,secco,pasta_sugo_carne,quotidiano,frutta rossa;speziato;scorrevole,12.0,10.0,available,,Rosso conviviale con ciliegia e spezie leggere. Ideale con pasta al sugo di carne.
39,Chardonnay Alto Adige DOC,Cantina Alto Adige Example,Italy,Trentino-Alto Adige,Alto Adige,Alto Adige,2023,chardonnay,bianco,bianco,medium,low,high,4.1,4.1,4.0,13.0,secco,risotto_frutti_mare,cena,elegante;agrumi;crosta di pane,19.0,16.5,available,,Bianco elegante e cremoso con agrumi e note di crosta di pane. Perfetto su risotto ai frutti di mare.
40,Barbera d'Asti DOCG,Cantina Piemonte Example,Italy,Piemonte,Asti,Barbera d'Asti,2022,barbera,rosso,rosso,medium,medium,high,4.0,4.1,4.0,14.0,secco,risotto_sugo_carne,cena,succoso;frutta rossa;acidità viva,16.0,13.5,available,,Rosso succoso con ciliegia e buona freschezza: regge bene risotti con sugo di carne.
41,Prosecco DOC Extra Dry,Cantina Veneto Example,Italy,Veneto,Treviso,Prosecco,NV,glera,bianco,spumante,low,low,high,3.9,4.0,3.8,11.5,abboccato,uova_torte_salata,aperitivo,spumante;fruttato;leggero,11.0,9.5,available,,Bollicina semplice e fragrante: pera e fiori bianchi. Ottimo con uova e torte salate.
42,Passito di Pantelleria DOC,Cantina Pantelleria Example,Italy,Sicilia,Pantelleria,Passito di Pantelleria,2021,zibibbo,bianco,dolce,high,low,medium,4.3,4.2,4.4,14.0,dolce,formaggi_erborinati,cena importante,dolce;albicocca;miele,32.0,28.0,available,,"Dolce intenso con albicocca, miele e scorza d’agrumi. Match classico con formaggi erborinati."
43,Wine Test antipasti_caldi_pesce,SommelierAI Dataset,Italy,Test Region,Test Zone,Wine Test antipasti_caldi_pesce,2023,chardonnay,bianco,bianco,medium,low,high,4.0,4.0,4.0,13.0,secco,antipasti_caldi_pesce,cena,test,18.0,15.0,available,,Riga tecnica per copertura tassonomia ufficiale.
44,Wine Test pasta_pesce_bianco,SommelierAI Dataset,Italy,Test Region,Test Zone,Wine Test pasta_pesce_bianco,2023,chardonnay,bianco,bianco,medium,low,high,4.0,4.0,4.0,13.0,secco,pasta_pesce_bianco,cena,test,18.0,15.0,available,,Riga tecnica per copertura tassonomia ufficiale.
45,Wine Test pasta_pesce_pomodoro,SommelierAI Dataset,Italy,Test Region,Test Zone,Wine Test pasta_pesce_pomodoro,2023,chardonnay,bianco,bianco,medium,low,high,4.0,4.0,4.0,13.0,secco,pasta_pesce_pomodoro,cena,test,18.0,15.0,available,,Riga tecnica per copertura tassonomia ufficiale.
46,Wine Test pasta_sugo_carne,SommelierAI Dataset,Italy,Test Region,Test Zone,Wine Test pasta_sugo_carne,2023,chardonnay,bianco,bianco,medium,low,high,4.0,4.0,4.0,13.0,secco,pasta_sugo_carne,cena,test,18.0,15.0,available,,Riga tecnica per copertura tassonomia ufficiale.
47,Wine Test risotto_frutti_mare,SommelierAI Dataset,Italy,Test Region,Test Zone,Wine Test risotto_frutti_mare,2023,chardonnay,bianco,bianco,medium,low,high,4.0,4.0,4.0,13.0,secco,risotto_frutti_mare,cena,test,18.0,15.0,available,,Riga tecnica per copertura tassonomia ufficiale.
48,Wine Test risotto_sugo_carne,SommelierAI Dataset,Italy,Test Region,Test Zone,Wine Test risotto_sugo_carne,2023,chardonnay,bianco,bianco,medium,low,high,4.0,4.0,4.0,13.0,secco,risotto_sugo_carne,cena,test,18.0,15.0,available,,Riga tecnica per copertura tassonomia ufficiale.
49,Wine Test uova_torte_salata,SommelierAI Dataset,Italy,Test Region,Test Zone,Wine Test uova_torte_salata,2023,chardonnay,bianco,bianco,medium,low,high,4.0,4.0,4.0,13.0,secco,uova_torte_salata,cena,test,18.0,15.0,available,,Riga tecnica per copertura tassonomia ufficiale.
50,Wine Test formaggi_erborinati,SommelierAI Dataset,Italy,Test Region,Test Zone,Wine Test formaggi_erborinati,2023,chardonnay,bianco,bianco,medium,low,high,4.0,4.0,4.0,13.0,secco,formaggi_erborinati,cena,test,18.0,15.0,available,,Riga tecnica per copertura tassonomia ufficiale.
